{"$defs":{"JsonValue":{"anyOf":[{"type":"boolean"},{"type":"integer"},{"type":"string"},{"items":{"$ref":"#/$defs/JsonValue"},"type":"array"},{"additionalProperties":{"$ref":"#/$defs/JsonValue"},"type":"object"},{"type":"null"}]}},"$id":"https://schemas.yoetz.dev/0.1/integrations/setup-readiness-1.0.0.schema.json","$schema":"https://json-schema.org/draft/2020-12/schema","additionalProperties":false,"properties":{"connection_observed":{"const":false,"default":false,"title":"Connection Observed","type":"boolean"},"facts":{"additionalProperties":{"$ref":"#/$defs/JsonValue"},"title":"Facts","type":"object"},"inspected_config_root":{"anyOf":[{"type":"string"},{"type":"null"}],"title":"Inspected Config Root"},"next_command":{"anyOf":[{"type":"string"},{"type":"null"}],"title":"Next Command"},"operation":{"enum":["connection","local","review"],"title":"Operation","type":"string"},"project":{"title":"Project","type":"string"},"reason":{"title":"Reason","type":"string"},"schema":{"const":"yoetz.setup-readiness/1","title":"Schema","type":"string"}},"required":["facts","inspected_config_root","next_command","operation","project","reason","schema"],"title":"setup-readiness","type":"object"}